<?xml version="1.0" encoding="ISO-8859-1" ?>
<!DOCTYPE giant_vis_style_file
  SYSTEM "giant_vis_style_file.dtd">

<giant_vis_style_file>

  <!-- ................................................................. -->
  <global_settings
    vis_window_background_color="RGB:AA/AA/AA"/> 

  <!-- ................................................................. -->
  <default_node_setting
    icon         = "test_node_icon_default_1.xpm"
    text_color   = "RGB:AA/AA/AA"
    border_color = "RGB:AA/AA/AA"
    fill_color   = "white"> 
     
    <node_attribute attribute_name = "SLoc"/>      
  </default_node_setting>
   
   
  <node_class_specific_setting 
    icon         = "test_node_icon_blue_1.xpm"
    text_color   = "red"
    border_color = "red"
    fill_color   = "red"> 
    
    <node_attribute attribute_name  = "SLoc"/>    
     
    <node_class     node_class_name = "IML_Root"/>
    <node_class     node_class_name = "HPGNode"/>
    <node_class     node_class_name = "OC_Parameter"/>    
        
    <node_class     node_class_name = "TC_Boolean"/>
  </node_class_specific_setting>
  
  
  <node_class_specific_setting 
    icon         = "test_node_icon_blue_1.xpm"
    text_color   = "black"
    border_color = "black"
    fill_color   = "black"> 
    
    <node_attribute attribute_name  = "SLoc"/>    
          
    <node_class     node_class_name = "TC_Boolean"/>      
  </node_class_specific_setting>
      
      
      
  <!-- ................................................................. -->
  <default_edge_setting
    line_color = "black"     
    text_color = "black"     
    line_style = "continuous_line"      
    show_label = "no" />  
      
</giant_vis_style_file>
