<?xml version="1.0" encoding="ISO-8859-1" ?>
<!DOCTYPE giant_vis_style_file
  SYSTEM "giant_vis_style_file.dtd">

<giant_vis_style_file>

  <!-- ................................................................. -->
  <global_settings
    vis_window_background_color="#FFFFFF"/> 

  <!-- ................................................................. -->
  <default_node_setting
    icon         = "../icons/giant_icon.xpm"
    text_color   = "#000000"
    border_color = "#000000"
    fill_color   = "#C4EDED"> 
     
    <node_attribute attribute_name  = "Parent"/>       
    <node_attribute attribute_name  = "SLoc"/>       
  </default_node_setting>
    
  <node_class_specific_setting 
    icon         = "../icons/IML_Root_icon_1.xpm"
    text_color   = "#000000"
    border_color = "#000000"
    fill_color   = "#50FF50"> 

    <node_attribute attribute_name  = "Parent"/>       
    <node_attribute attribute_name  = "SLoc"/>   
    <node_attribute attribute_name  = "Artificial"/>       

    <node_class node_class_name = "IML_Root"/>  
  </node_class_specific_setting>
  
  
  <node_class_specific_setting 
    icon         = "../icons/test_node_icon_red_1.xpm"
    text_color   = "#FFFFFF"
    border_color = "#000000"
    fill_color   = "#5050FF"> 
    
    <node_attribute attribute_name  = "SLoc"/>   
    <node_attribute attribute_name  = "CF_Next"/>     
    <node_attribute attribute_name  = "CF_Previous"/>   
    <node_attribute attribute_name  = "CF_Basic_Block"/>     
                             
    <super_node_class   super_node_class_name = "Value"/> 
  </node_class_specific_setting>
      
     
  <node_class_specific_setting 
    icon         = "../icons/T_Node_icon_1.xpm"
    text_color   = "#000000"
    border_color = "#000000"
    fill_color   = "#FFD000"> 
    
    <node_attribute attribute_name  = "SLoc"/>   
    <node_attribute attribute_name  = "Namespace_Name"/>     
    <node_attribute attribute_name  = "Type_Size"/>   
                                
    <super_node_class   super_node_class_name = "T_Node"/> 
  </node_class_specific_setting>
  
  <node_class_specific_setting 
    icon         = "../icons/test_node_icon_blue_1.xpm"
    text_color   = "#000000"
    border_color = "#000000"
    fill_color   = "#60FFFF"> 
    
    <node_attribute attribute_name  = "Parent"/>   
    <node_attribute attribute_name  = "SLoc"/>     
    <node_attribute attribute_name  = "Name"/>   
                                
    <super_node_class   super_node_class_name = "O_Node"/> 
  </node_class_specific_setting>

  <!-- ................................................................. -->
  <default_edge_setting
    line_color = "#000000"     
    text_color = "#000000"     
    line_style = "dotted_line"      
    show_label = "no" />  
    
  <edge_class_specific_setting
    line_color = "#FFD000"
    text_color = "#FFD000"
    line_style = "dashed_line"
    show_label = "yes"> 
            
    <super_edge_class
      super_start_node_class = "T_Node"
      attribute_name   = "*" />                    
  </edge_class_specific_setting> 
       
  <edge_class_specific_setting
    line_color = "#FF0000"
    text_color = "#FF0000"
    line_style = "continuous_line"
    show_label = "yes"> 
            
    <edge_class
      start_node_class = "*"
      attribute_name   = "Parent" />                    
  </edge_class_specific_setting> 
                 
</giant_vis_style_file>
