<?xml version="1.0" encoding="ISO-8859-1" ?>
<!DOCTYPE giant_vis_style_file
  SYSTEM "giant_vis_style_file.dtd">

<giant_vis_style_file>

   <!-- ................................................................. -->
   <global_settings
      vis_window_background_color="RBG:AA/AA/AA"/> 

   <!-- ................................................................. -->

   <default_node_setting
      icon         = "./my_test_icon.xpm"
      text_color   = "RGB:AA/AA/AA"
      border_color = "RGB:AA/AA/AA"
      fill_color   = "RGB:AA/AA/AA"> 

      <node_attribute attribute_name = "Attribute_1" />
      <node_attribute attribute_name = "Attribute_2" />    
      <node_attribute attribute_name = "Attribute_3" />        
      <node_attribute attribute_name = "Attribute_4" />   
   </default_node_setting>

   <node_class_specific_setting
      icon         = "./my_test_icon.xpm"
      text_color   = "RGB:AA/AA/AA"
      border_color = "RGB:AA/AA/AA"
      fill_color   = "RGB:AA/AA/AA">

      <node_attribute attribute_name = "Attribute_1" />
      <node_attribute attribute_name = "Attribute_2" />   

      <!-- Only the following node classes are affected by the
           settings inside the <node_class_specific_setting> node -->
      <node_class node_class_name = "Dagobert Duck" />
      <node_class node_class_name = "Daisy Duck" />   
      <node_class node_class_name = "Gustav Gans" />   
   </node_class_specific_setting> 

   <!-- ................................................................. -->
   <default_edge_setting
      line_color = "RGB:AA/AA/AA"     
      text_color = "RGB:AA/AA/AA"     
      line_style = "dotted_line"
      show_label = "yes" />  

   <edge_class_specific_setting
      line_color = "RGB:AA/AA/AA"     
      text_color = "RGB:AA/AA/AA"     
      line_style = "dotted_line"
      show_label = "yes" >
       
      <!-- Edge classes that are affected by this setting -->
      <edge_class
         start_node_class = "Dagobert" attribute_name = "Anzahl Federn" />
      <edge_class
         start_node_class = "Daisy" attribute_name = "*" />
      <edge_class
         start_node_class = "*" attribute_name = "IQ Edge" />
   </edge_class_specific_setting> 

</giant_vis_style_file>
